{
  "schema": "skenion.object-text.parse-result",
  "schemaVersion": "0.1.0",
  "input": "[*~ 0.5 2]",
  "ok": true,
  "className": "*~",
  "creationArgs": [
    {
      "type": "float",
      "value": 0.5,
      "representation": "f32"
    },
    {
      "type": "int",
      "value": 2,
      "representation": "i32"
    }
  ],
  "resolvedKind": null,
  "resolvedKindVersion": null,
  "params": {},
  "instancePorts": [],
  "displayText": "*~ 0.5 2",
  "diagnostics": []
}
